UniProt_ID,GO_BP,GO_CC,GO_MF,Tissue_specificity,Interactors,Function,Reactome_ID,KEGG_ID
P05154,blood coagulation [GO:0007596]; fusion of sperm to egg plasma membrane involved in single fertilization [GO:0007342]; lipid transport [GO:0006869]; negative regulation of endopeptidase activity [GO:0010951]; negative regulation of hydrolase activity [GO:0051346]; seminal vesicle development [GO:0061107]; spermatogenesis [GO:0007283],acrosomal membrane [GO:0002080]; external side of plasma membrane [GO:0009897]; extracellular exosome [GO:0070062]; extracellular region [GO:0005576]; extracellular space [GO:0005615]; membrane [GO:0016020]; platelet alpha granule [GO:0031091]; platelet dense tubular network [GO:0031094]; protein C inhibitor-coagulation factor V complex [GO:0097181]; protein C inhibitor-coagulation factor Xa complex [GO:0097182]; protein C inhibitor-coagulation factor XI complex [GO:0097183]; protein C inhibitor-KLK3 complex [GO:0036029]; protein C inhibitor-plasma kallikrein complex [GO:0036030]; protein C inhibitor-PLAT complex [GO:0036026]; protein C inhibitor-PLAU complex [GO:0036027]; protein C inhibitor-thrombin complex [GO:0036028]; protein C inhibitor-TMPRSS11E complex [GO:0036025]; protein C inhibitor-TMPRSS7 complex [GO:0036024]; protein-containing complex [GO:0032991],acrosin binding [GO:0032190]; glycosaminoglycan binding [GO:0005539]; heparin binding [GO:0008201]; phosphatidylcholine binding [GO:0031210]; protease binding [GO:0002020]; retinoic acid binding [GO:0001972]; serine-type endopeptidase inhibitor activity [GO:0004867],"Predominantly expressed in the epithelium of seminal vesicles. Expressed in the proximal tubular epithelium of the kidney. Expressed in the superficial and more differentiated epidermal keratinocytes of the skin. Expressed in megakaryocytes and platelets. Expressed poorly in kidney tumor cells compared to non tumor kidney tissues. Expressed in spermatozoa. Present in very high concentration in seminal plasma. Present in high concentration in plasma, synovial and Graaf follicle fluids. Present in low concentration in breast milk and in amniotic fluids. Present in very low concentration in urine, cerebrospinal fluids, saliva and tears (at protein level). Strongly expressed in liver. Expressed in kidney, spleen, pancreas, skeletal muscle, heart, testes, ovary, interstitial Leydig cells, epididymal glands, seminal vesicles and prostate. {ECO:0000269|PubMed:1372913, ECO:0000269|PubMed:14696115, ECO:0000269|PubMed:15140131, ECO:0000269|PubMed:17706750, ECO:0000269|PubMed:18467335, ECO:0000269|PubMed:9510955, ECO:0000269|PubMed:9556620}.",,"Heparin-dependent serine protease inhibitor acting in body fluids and secretions. Inactivates serine proteases by binding irreversibly to their serine activation site. Involved in the regulation of intravascular and extravascular proteolytic activities. Plays hemostatic roles in the blood plasma. Acts as a procoagulant and proinflammatory factor by inhibiting the anticoagulant activated protein C factor as well as the generation of activated protein C factor by the thrombin/thrombomodulin complex. Acts as an anticoagulant factor by inhibiting blood coagulation factors like prothrombin, factor XI, factor Xa, plasma kallikrein and fibrinolytic enzymes such as tissue- and urinary-type plasminogen activators. In seminal plasma, inactivates several serine proteases implicated in the reproductive system. Inhibits the serpin acrosin; indirectly protects component of the male genital tract from being degraded by excessive released acrosin. Inhibits tissue-and urinary-type plasminogen activator, prostate-specific antigen and kallikrein activities; has a control on the sperm motility and fertilization. Inhibits the activated protein C-catalyzed degradation of SEMG1 and SEMG2; regulates the degradation of semenogelin during the process of transfer of spermatozoa from the male reproductive tract into the female tract. In urine, inhibits urinary-type plasminogen activator and kallikrein activities. Inactivates membrane-anchored serine proteases activities such as MPRSS7 and TMPRSS11E. Inhibits urinary-type plasminogen activator-dependent tumor cell invasion and metastasis. May also play a non-inhibitory role in seminal plasma and urine as a hydrophobic hormone carrier by its binding to retinoic acid. {ECO:0000269|PubMed:10340997, ECO:0000269|PubMed:11722589, ECO:0000269|PubMed:14696115, ECO:0000269|PubMed:15140131, ECO:0000269|PubMed:15328353, ECO:0000269|PubMed:15853774, ECO:0000269|PubMed:1725227, ECO:0000269|PubMed:18467335, ECO:0000269|PubMed:2844223, ECO:0000269|PubMed:3501295, ECO:0000269|PubMed:6323392, ECO:0000269|PubMed:7521127, ECO:0000269|PubMed:7548057, ECO:0000269|PubMed:8536714, ECO:0000269|PubMed:8665956, ECO:0000269|PubMed:9473218, ECO:0000269|PubMed:9510955, ECO:0000269|PubMed:9556620}.",R-HSA-140837;R-HSA-140875;,hsa:5104;
P05164,aging [GO:0007568]; cell redox homeostasis [GO:0045454]; defense response [GO:0006952]; defense response to bacterium [GO:0042742]; defense response to fungus [GO:0050832]; hydrogen peroxide catabolic process [GO:0042744]; hypochlorous acid biosynthetic process [GO:0002149]; low-density lipoprotein particle remodeling [GO:0034374]; negative regulation of apoptotic process [GO:0043066]; neutrophil degranulation [GO:0043312]; oxidation-reduction process [GO:0055114]; removal of superoxide radicals [GO:0019430]; respiratory burst involved in defense response [GO:0002679]; response to food [GO:0032094]; response to gold nanoparticle [GO:1990268]; response to lipopolysaccharide [GO:0032496]; response to mechanical stimulus [GO:0009612]; response to oxidative stress [GO:0006979]; response to yeast [GO:0001878],azurophil granule [GO:0042582]; azurophil granule lumen [GO:0035578]; cell [GO:0005623]; cytoplasm [GO:0005737]; extracellular exosome [GO:0070062]; extracellular region [GO:0005576]; extracellular space [GO:0005615]; intracellular membrane-bounded organelle [GO:0043231]; lysosome [GO:0005764]; nucleoplasm [GO:0005654]; nucleus [GO:0005634]; phagocytic vesicle lumen [GO:0097013]; secretory granule [GO:0030141],chromatin binding [GO:0003682]; heme binding [GO:0020037]; heparin binding [GO:0008201]; metal ion binding [GO:0046872]; peroxidase activity [GO:0004601],,,"Part of the host defense system of polymorphonuclear leukocytes. It is responsible for microbicidal activity against a wide range of organisms. In the stimulated PMN, MPO catalyzes the production of hypohalous acids, primarily hypochlorous acid in physiologic situations, and other toxic intermediates that greatly enhance PMN microbicidal activity. {ECO:0000269|PubMed:9922160}.",R-HSA-6798695;R-HSA-8941413;,hsa:4353;
P05231,"acute-phase response [GO:0006953]; cellular protein metabolic process [GO:0044267]; cellular response to hydrogen peroxide [GO:0070301]; cellular response to lipopolysaccharide [GO:0071222]; cytokine-mediated signaling pathway [GO:0019221]; defense response to Gram-negative bacterium [GO:0050829]; defense response to Gram-positive bacterium [GO:0050830]; defense response to virus [GO:0051607]; endocrine pancreas development [GO:0031018]; glucagon secretion [GO:0070091]; hepatic immune response [GO:0002384]; humoral immune response [GO:0006959]; inflammatory response [GO:0006954]; interleukin-6-mediated signaling pathway [GO:0070102]; monocyte chemotaxis [GO:0002548]; negative regulation of apoptotic process [GO:0043066]; negative regulation of bone resorption [GO:0045779]; negative regulation of cell population proliferation [GO:0008285]; negative regulation of chemokine biosynthetic process [GO:0045079]; negative regulation of collagen biosynthetic process [GO:0032966]; negative regulation of fat cell differentiation [GO:0045599]; negative regulation of interleukin-1-mediated signaling pathway [GO:2000660]; negative regulation of lipid storage [GO:0010888]; negative regulation of neurogenesis [GO:0050768]; neuron cellular homeostasis [GO:0070050]; neuron projection development [GO:0031175]; neutrophil apoptotic process [GO:0001781]; neutrophil mediated immunity [GO:0002446]; platelet activation [GO:0030168]; positive regulation of acute inflammatory response [GO:0002675]; positive regulation of apoptotic DNA fragmentation [GO:1902512]; positive regulation of apoptotic process [GO:0043065]; positive regulation of B cell activation [GO:0050871]; positive regulation of cell population proliferation [GO:0008284]; positive regulation of chemokine production [GO:0032722]; positive regulation of DNA-binding transcription factor activity [GO:0051091]; positive regulation of epithelial to mesenchymal transition [GO:0010718]; positive regulation of extracellular matrix disassembly [GO:0090091]; positive regulation of gene expression [GO:0010628]; positive regulation of glial cell proliferation [GO:0060252]; positive regulation of immunoglobulin secretion [GO:0051024]; positive regulation of interleukin-17 biosynthetic process [GO:0045380]; positive regulation of interleukin-6 production [GO:0032755]; positive regulation of leukocyte chemotaxis [GO:0002690]; positive regulation of MAPK cascade [GO:0043410]; positive regulation of neuroinflammatory response [GO:0150078]; positive regulation of osteoblast differentiation [GO:0045669]; positive regulation of peptidyl-serine phosphorylation [GO:0033138]; positive regulation of peptidyl-tyrosine phosphorylation [GO:0050731]; positive regulation of receptor signaling pathway via JAK-STAT [GO:0046427]; positive regulation of smooth muscle cell proliferation [GO:0048661]; positive regulation of T cell proliferation [GO:0042102]; positive regulation of T-helper 2 cell cytokine production [GO:2000553]; positive regulation of transcription, DNA-templated [GO:0045893]; positive regulation of transcription by RNA polymerase II [GO:0045944]; positive regulation of translation [GO:0045727]; positive regulation of type B pancreatic cell apoptotic process [GO:2000676]; positive regulation of tyrosine phosphorylation of STAT protein [GO:0042531]; positive regulation of vascular endothelial growth factor production [GO:0010575]; post-translational protein modification [GO:0043687]; regulation of angiogenesis [GO:0045765]; regulation of astrocyte activation [GO:0061888]; regulation of maintenance of permeability of blood-brain barrier [GO:1905603]; regulation of microglial cell activation [GO:1903978]; regulation of neuroinflammatory response [GO:0150077]; regulation of vascular endothelial growth factor production [GO:0010574]; response to glucocorticoid [GO:0051384]; response to peptidoglycan [GO:0032494]; T-helper 17 cell lineage commitment [GO:0072540]",cell [GO:0005623]; endoplasmic reticulum lumen [GO:0005788]; extracellular region [GO:0005576]; extracellular space [GO:0005615]; interleukin-6 receptor complex [GO:0005896],cytokine activity [GO:0005125]; growth factor activity [GO:0008083]; interleukin-6 receptor binding [GO:0005138],,P08887; Q05516,"Cytokine with a wide variety of biological functions. It is a potent inducer of the acute phase response. Plays an essential role in the final differentiation of B-cells into Ig-secreting cells Involved in lymphocyte and monocyte differentiation. Acts on B-cells, T-cells, hepatocytes, hematopoietic progenitor cells and cells of the CNS. Required for the generation of T(H)17 cells. Also acts as a myokine. It is discharged into the bloodstream after muscle contraction and acts to increase the breakdown of fats and to improve insulin resistance. It induces myeloma and plasmacytoma growth and induces nerve cells differentiation.",R-HSA-1059683;R-HSA-110056;R-HSA-112411;R-HSA-2559582;R-HSA-381426;R-HSA-6783783;R-HSA-6785807;R-HSA-8957275;,hsa:3569;
P05362,acute inflammatory response to antigenic stimulus [GO:0002438]; adhesion of symbiont to host [GO:0044406]; cell adhesion [GO:0007155]; cell adhesion mediated by integrin [GO:0033627]; cell aging [GO:0007569]; cellular response to alkaloid [GO:0071312]; cellular response to amyloid-beta [GO:1904646]; cellular response to dexamethasone stimulus [GO:0071549]; cellular response to glucose stimulus [GO:0071333]; cellular response to hypoxia [GO:0071456]; cellular response to interleukin-1 [GO:0071347]; cellular response to interleukin-6 [GO:0071354]; cellular response to leukemia inhibitory factor [GO:1990830]; cellular response to lipopolysaccharide [GO:0071222]; cellular response to nutrient levels [GO:0031669]; cellular response to tumor necrosis factor [GO:0071356]; cytokine-mediated signaling pathway [GO:0019221]; establishment of endothelial barrier [GO:0061028]; establishment of endothelial intestinal barrier [GO:0090557]; establishment of Sertoli cell barrier [GO:0097368]; extracellular matrix organization [GO:0030198]; heterophilic cell-cell adhesion via plasma membrane cell adhesion molecules [GO:0007157]; interferon-gamma-mediated signaling pathway [GO:0060333]; leukocyte cell-cell adhesion [GO:0007159]; leukocyte migration [GO:0050900]; membrane to membrane docking [GO:0022614]; negative regulation of calcium ion transport [GO:0051926]; negative regulation of endothelial cell apoptotic process [GO:2000352]; negative regulation of extrinsic apoptotic signaling pathway via death domain receptors [GO:1902042]; ovarian follicle development [GO:0001541]; positive regulation of actin filament polymerization [GO:0030838]; positive regulation of cellular extravasation [GO:0002693]; positive regulation of ERK1 and ERK2 cascade [GO:0070374]; positive regulation of GTPase activity [GO:0043547]; positive regulation of leukocyte adhesion to vascular endothelial cell [GO:1904996]; positive regulation of NF-kappaB transcription factor activity [GO:0051092]; positive regulation of nitric oxide biosynthetic process [GO:0045429]; positive regulation of peptidyl-tyrosine phosphorylation [GO:0050731]; positive regulation of vasoconstriction [GO:0045907]; receptor-mediated virion attachment to host cell [GO:0046813]; regulation of cell shape [GO:0008360]; regulation of immune response [GO:0050776]; regulation of leukocyte mediated cytotoxicity [GO:0001910]; regulation of ruffle assembly [GO:1900027]; response to amino acid [GO:0043200]; response to amphetamine [GO:0001975]; response to copper ion [GO:0046688]; response to ethanol [GO:0045471]; response to gonadotropin [GO:0034698]; response to insulin [GO:0032868]; response to ionizing radiation [GO:0010212]; response to sulfur dioxide [GO:0010477]; sensory perception of sound [GO:0007605]; T cell activation via T cell receptor contact with antigen bound to MHC molecule on antigen presenting cell [GO:0002291]; T cell antigen processing and presentation [GO:0002457]; T cell extravasation [GO:0072683],cell [GO:0005623]; cell surface [GO:0009986]; collagen-containing extracellular matrix [GO:0062023]; external side of plasma membrane [GO:0009897]; extracellular exosome [GO:0070062]; extracellular space [GO:0005615]; focal adhesion [GO:0005925]; immunological synapse [GO:0001772]; integral component of plasma membrane [GO:0005887]; membrane [GO:0016020]; membrane raft [GO:0045121]; plasma membrane [GO:0005886],integrin binding [GO:0005178]; signaling receptor activity [GO:0038023]; transmembrane signaling receptor activity [GO:0004888]; virus receptor activity [GO:0001618],,P20701,"ICAM proteins are ligands for the leukocyte adhesion protein LFA-1 (integrin alpha-L/beta-2). During leukocyte trans-endothelial migration, ICAM1 engagement promotes the assembly of endothelial apical cups through ARHGEF26/SGEF and RHOG activation. {ECO:0000269|PubMed:11173916, ECO:0000269|PubMed:17875742}.; (Microbial infection) Acts as a receptor for major receptor group rhinovirus A-B capsid proteins. {ECO:0000269|PubMed:1968231, ECO:0000269|PubMed:2538243}.; (Microbial infection) Acts as a receptor for Coxsackievirus A21 capsid proteins. {ECO:0000269|PubMed:11160747, ECO:0000269|PubMed:16004874, ECO:0000269|PubMed:9539703}.; (Microbial infection) Upon Kaposi's sarcoma-associated herpesvirus/HHV-8 infection, is degraded by viral E3 ubiquitin ligase MIR2, presumably to prevent lysis of infected cells by cytotoxic T-lymphocytes and NK cell. {ECO:0000269|PubMed:11413168}.",R-HSA-198933;R-HSA-216083;R-HSA-6783783;R-HSA-6785807;R-HSA-877300;,hsa:3383;
P05451,antimicrobial humoral immune response mediated by antimicrobial peptide [GO:0061844]; calcium ion homeostasis [GO:0055074]; cellular response to chemokine [GO:1990869]; cellular response to gastrin [GO:1990878]; cell wall disruption in other organism [GO:0044278]; liver regeneration [GO:0097421]; midgut development [GO:0007494]; negative regulation of cell population proliferation [GO:0008285]; pancreas regeneration [GO:1990798]; positive regulation of acinar cell proliferation [GO:1904699]; positive regulation of cell population proliferation [GO:0008284]; positive regulation of dendrite extension [GO:1903861]; positive regulation of gene expression [GO:0010628]; positive regulation of type B pancreatic cell proliferation [GO:1904692]; protein homotetramerization [GO:0051289]; response to acetylsalicylate [GO:1903492]; response to growth hormone-releasing hormone [GO:1990864]; response to hypoxia [GO:0001666]; response to nutrient levels [GO:0031667]; response to peptide hormone [GO:0043434]; response to water-immersion restraint stress [GO:1990785]; wound healing [GO:0042060],basal part of cell [GO:0045178]; cytosol [GO:0005829]; dendrite membrane [GO:0032590]; extracellular exosome [GO:0070062]; extracellular space [GO:0005615]; growth cone [GO:0030426]; neuronal cell body membrane [GO:0032809]; perinuclear region of cytoplasm [GO:0048471]; protein-containing complex [GO:0032991]; zymogen granule [GO:0042588],growth factor activity [GO:0008083]; oligosaccharide binding [GO:0070492]; peptidoglycan binding [GO:0042834]; protein homodimerization activity [GO:0042803]; protein phosphatase binding [GO:0019903]; transmembrane signaling receptor activity [GO:0004888],"In pancreatic acinar cells and, in lower levels, in brain. Enhanced expression of PSP-related transcripts and intraneuronal accumulation of PSP-like proteins is found in brain from Alzheimer disease and Down syndrome patients. {ECO:0000269|PubMed:2394826}.",,"Might act as an inhibitor of spontaneous calcium carbonate precipitation. May be associated with neuronal sprouting in brain, and with brain and pancreas regeneration.",,hsa:5967;
P05543,negative regulation of endopeptidase activity [GO:0010951]; thyroid hormone transport [GO:0070327],extracellular exosome [GO:0070062]; extracellular region [GO:0005576]; extracellular space [GO:0005615],serine-type endopeptidase inhibitor activity [GO:0004867],Expressed by the liver and secreted in plasma.,,Major thyroid hormone transport protein in serum.,,hsa:6906;
P06127,apoptotic signaling pathway [GO:0097190]; cell population proliferation [GO:0008283]; cell recognition [GO:0008037]; T cell costimulation [GO:0031295],external side of plasma membrane [GO:0009897]; integral component of plasma membrane [GO:0005887]; plasma membrane [GO:0005886],scavenger receptor activity [GO:0005044]; signaling receptor activity [GO:0038023]; transmembrane signaling receptor activity [GO:0004888],,,May act as a receptor in regulating T-cell proliferation.,,hsa:921;
P06681,"complement activation [GO:0006956]; complement activation, classical pathway [GO:0006958]; innate immune response [GO:0045087]; positive regulation of apoptotic cell clearance [GO:2000427]; regulation of complement activation [GO:0030449]; response to nutrient [GO:0007584]",extracellular exosome [GO:0070062]; extracellular region [GO:0005576]; extracellular space [GO:0005615],metal ion binding [GO:0046872]; serine-type endopeptidase activity [GO:0004252],,O43889-2,"Component C2 which is part of the classical pathway of the complement system is cleaved by activated factor C1 into two fragments: C2b and C2a. C2a, a serine protease, then combines with complement factor C4b to generate the C3 or C5 convertase.",R-HSA-166663;R-HSA-174577;R-HSA-977606;,hsa:717;
P06748,"cell aging [GO:0007569]; cellular response to UV [GO:0034644]; cell volume homeostasis [GO:0006884]; CENP-A containing nucleosome assembly [GO:0034080]; centrosome cycle [GO:0007098]; chromatin remodeling [GO:0006338]; DNA repair [GO:0006281]; intracellular protein transport [GO:0006886]; negative regulation of apoptotic process [GO:0043066]; negative regulation of cell population proliferation [GO:0008285]; negative regulation of centrosome duplication [GO:0010826]; negative regulation of mRNA splicing, via spliceosome [GO:0048025]; negative regulation of protein kinase activity by regulation of protein phosphorylation [GO:0044387]; nucleocytoplasmic transport [GO:0006913]; nucleosome assembly [GO:0006334]; positive regulation of cell cycle G2/M phase transition [GO:1902751]; positive regulation of cell population proliferation [GO:0008284]; positive regulation of centrosome duplication [GO:0010825]; positive regulation of NF-kappaB transcription factor activity [GO:0051092]; positive regulation of protein kinase activity [GO:0045860]; positive regulation of protein localization to nucleolus [GO:1904751]; positive regulation of protein ubiquitination [GO:0031398]; positive regulation of transcription, DNA-templated [GO:0045893]; positive regulation of transcription by RNA polymerase II [GO:0045944]; positive regulation of translation [GO:0045727]; protein localization [GO:0008104]; protein stabilization [GO:0050821]; regulation of cell growth [GO:0001558]; regulation of centriole replication [GO:0046599]; regulation of centrosome duplication [GO:0010824]; regulation of DNA damage response, signal transduction by p53 class mediator [GO:0043516]; regulation of eIF2 alpha phosphorylation by dsRNA [GO:0060735]; regulation of endodeoxyribonuclease activity [GO:0032071]; regulation of endoribonuclease activity [GO:0060699]; regulation of mRNA stability involved in cellular response to UV [GO:1902629]; regulation of transcription by RNA polymerase II [GO:0006357]; ribosomal large subunit biogenesis [GO:0042273]; ribosomal large subunit export from nucleus [GO:0000055]; ribosomal small subunit biogenesis [GO:0042274]; ribosomal small subunit export from nucleus [GO:0000056]; ribosome assembly [GO:0042255]; rRNA export from nucleus [GO:0006407]; signal transduction [GO:0007165]; viral process [GO:0016032]",cell [GO:0005623]; centrosome [GO:0005813]; cytoplasm [GO:0005737]; cytosol [GO:0005829]; focal adhesion [GO:0005925]; granular component [GO:0001652]; large ribosomal subunit [GO:0015934]; membrane [GO:0016020]; nuclear speck [GO:0016607]; nucleolus [GO:0005730]; nucleoplasm [GO:0005654]; nucleus [GO:0005634]; protein-containing complex [GO:0032991]; protein-DNA complex [GO:0032993]; ribonucleoprotein complex [GO:1990904]; small ribosomal subunit [GO:0015935]; spindle pole centrosome [GO:0031616],activating transcription factor binding [GO:0033613]; chromatin binding [GO:0003682]; core promoter binding [GO:0001047]; histone binding [GO:0042393]; NF-kappaB binding [GO:0051059]; protein heterodimerization activity [GO:0046982]; protein homodimerization activity [GO:0042803]; protein kinase binding [GO:0019901]; protein kinase inhibitor activity [GO:0004860]; protein N-terminus binding [GO:0047485]; ribosomal large subunit binding [GO:0043023]; ribosomal small subunit binding [GO:0043024]; RNA binding [GO:0003723]; rRNA binding [GO:0019843]; Tat protein binding [GO:0030957]; transcription coactivator activity [GO:0003713]; transcription factor binding [GO:0008134]; unfolded protein binding [GO:0051082],,Q98147; O14965; Q96GD4; Q8N726; P49450-1; P10176; Q10570; P19525; Q13547; Q92769; Q9BXL5; P24938; P68951; Q71RC2; P0DOE7; Q00987; Q9BZQ8; Q86SE8; Q86SE8-2; Q8IZL8; B1Q2W9; P62753; Q9H4L4; P63165; P05549; P04637; Q14669; P63104,"Involved in diverse cellular processes such as ribosome biogenesis, centrosome duplication, protein chaperoning, histone assembly, cell proliferation, and regulation of tumor suppressors p53/TP53 and ARF. Binds ribosome presumably to drive ribosome nuclear export. Associated with nucleolar ribonucleoprotein structures and bind single-stranded nucleic acids. Acts as a chaperonin for the core histones H3, H2B and H4. Stimulates APEX1 endonuclease activity on apurinic/apyrimidinic (AP) double-stranded DNA but inhibits APEX1 endonuclease activity on AP single-stranded RNA. May exert a control of APEX1 endonuclease activity within nucleoli devoted to repair AP on rDNA and the removal of oxidized rRNA molecules. In concert with BRCA2, regulates centrosome duplication. Regulates centriole duplication: phosphorylation by PLK2 is able to trigger centriole replication. Negatively regulates the activation of EIF2AK2/PKR and suppresses apoptosis through inhibition of EIF2AK2/PKR autophosphorylation. Antagonizes the inhibitory effect of ATF5 on cell proliferation and relieves ATF5-induced G2/M blockade (PubMed:22528486). In complex with MYC enhances the transcription of MYC target genes (PubMed:25956029). {ECO:0000269|PubMed:12882984, ECO:0000269|PubMed:16107701, ECO:0000269|PubMed:17015463, ECO:0000269|PubMed:18809582, ECO:0000269|PubMed:19188445, ECO:0000269|PubMed:20352051, ECO:0000269|PubMed:21084279, ECO:0000269|PubMed:22002061, ECO:0000269|PubMed:22528486, ECO:0000269|PubMed:25956029}.",R-HSA-180746;R-HSA-3899300;R-HSA-606279;R-HSA-6804115;R-HSA-8869496;,hsa:4869;
