UniProt_ID,GO_BP,GO_CC,GO_MF,Tissue_specificity,Interactors,Function,Reactome_ID,KEGG_ID
P21246,bone mineralization [GO:0030282]; cellular response to hypoxia [GO:0071456]; cellular response to platelet-derived growth factor stimulus [GO:0036120]; cellular response to UV [GO:0034644]; cellular response to vitamin D [GO:0071305]; cerebellum development [GO:0021549]; decidualization [GO:0046697]; dendrite arborization [GO:0140059]; dendrite regeneration [GO:0031104]; endothelial cell differentiation [GO:0045446]; estrous cycle [GO:0044849]; heart development [GO:0007507]; integrin-mediated signaling pathway [GO:0007229]; learning [GO:0007612]; leukocyte chemotaxis involved in inflammatory response [GO:0002232]; liver development [GO:0001889]; long-term synaptic potentiation [GO:0060291]; lung development [GO:0030324]; memory [GO:0007613]; negative regulation of angiogenesis [GO:0016525]; negative regulation of cell migration [GO:0030336]; negative regulation of epithelial cell proliferation [GO:0050680]; negative regulation of glial cell proliferation [GO:0060253]; negative regulation of long-term synaptic potentiation [GO:1900272]; negative regulation of membrane potential [GO:0045837]; negative regulation of mesenchymal cell proliferation [GO:0072201]; negative regulation of neuroblast proliferation [GO:0007406]; negative regulation of neuromuscular junction development [GO:1904397]; nervous system development [GO:0007399]; oogenesis [GO:0048477]; ossification involved in bone remodeling [GO:0043932]; positive regulation of apoptotic process [GO:0043065]; positive regulation of axon regeneration [GO:0048680]; positive regulation of bone mineralization [GO:0030501]; positive regulation of cell division [GO:0051781]; positive regulation of cell population proliferation [GO:0008284]; positive regulation of cell-substrate adhesion [GO:0010811]; positive regulation of dendrite development [GO:1900006]; positive regulation of hepatocyte proliferation [GO:2000347]; positive regulation of leukocyte chemotaxis [GO:0002690]; positive regulation of neuron projection development [GO:0010976]; positive regulation of oligodendrocyte differentiation [GO:0048714]; positive regulation of ossification [GO:0045778]; positive regulation of skeletal muscle acetylcholine-gated channel clustering [GO:1904395]; positive regulation of stem cell differentiation [GO:2000738]; receptor clustering [GO:0043113]; regulation of cell shape [GO:0008360]; regulation of endothelial cell migration [GO:0010594]; regulation of hemopoiesis [GO:1903706]; regulation of myelination [GO:0031641]; regulation of stem cell population maintenance [GO:2000036]; regulation of synaptic plasticity [GO:0048167]; response to activity [GO:0014823]; response to auditory stimulus [GO:0010996]; response to ciliary neurotrophic factor [GO:1904391]; response to estradiol [GO:0032355]; response to kainic acid [GO:1904373]; response to nerve growth factor [GO:1990089]; response to progesterone [GO:0032570]; retinal rod cell differentiation [GO:0060221]; rod bipolar cell differentiation [GO:1904389]; spinal cord development [GO:0021510]; thalamus development [GO:0021794]; tissue regeneration [GO:0042246]; transmembrane receptor protein tyrosine phosphatase signaling pathway [GO:0007185],basement membrane [GO:0005604]; cell surface [GO:0009986]; endoplasmic reticulum [GO:0005783]; extracellular region [GO:0005576]; extracellular space [GO:0005615]; neuromuscular junction [GO:0031594]; perinuclear region of cytoplasm [GO:0048471]; plasma membrane [GO:0005886]; postsynapse [GO:0098794]; presynapse [GO:0098793]; protein-containing complex [GO:0032991],chondroitin sulfate binding [GO:0035374]; chondroitin sulfate proteoglycan binding [GO:0035373]; growth factor activity [GO:0008083]; heparan sulfate binding [GO:1904399]; heparin binding [GO:0008201]; integrin binding [GO:0005178]; protein kinase binding [GO:0019901]; protein phosphatase inhibitor activity [GO:0004864]; syndecan binding [GO:0045545]; vascular endothelial growth factor binding [GO:0038085],Osteoblast and brain. {ECO:0000269|PubMed:1701634}.,,"Secreted growth factor that mediates its signal through cell-surface proteoglycan and non-proteoglycan receptors (PubMed:16814777, PubMed:11278720, PubMed:19141530). Binds cell-surface proteoglycan receptor via their chondroitin sulfate (CS) groups (PubMed:26896299, PubMed:27445335). Thereby regulates many processes like cell proliferation, cell survival, cell growth, cell differentiation and cell migration in several tissues namely neuron and bone (PubMed:1733956, PubMed:1768439, PubMed:11278720, PubMed:19141530, PubMed:27445335, PubMed:30667096, PubMed:19442624). Also plays a role in synaptic plasticity and learning-related behavior by inhibiting long-term synaptic potentiation (By similarity). Binds PTPRZ1, leading to neutralization of the negative charges of the CS chains of PTPRZ1, inducing PTPRZ1 clustering, thereby causing the dimerization and inactivation of its phosphatase activity leading to increased tyrosine phosphorylation of each of the PTPRZ1 substrates like ALK, CTNNB1 or AFAP1L2 in order to activate the PI3K-AKT pathway (PubMed:17681947, PubMed:27445335, PubMed:30667096, PubMed:16814777, PubMed:10706604). Through PTPRZ1 binding controls oligodendrocyte precursor cell differentiation by enhancing the phosphorylation of AFAP1L2 in order to activate the PI3K-AKT pathway (PubMed:27445335, PubMed:30667096). Forms a complex with PTPRZ1 and integrin alpha-V/beta-3 (ITGAV:ITGB3) that stimulates endothelial cell migration through SRC dephosphorylation and activation that consequently leads to ITGB3 'Tyr-773' phosphorylation (PubMed:19141530). In adult hippocampus promotes dendritic arborization, spine development, and functional integration and connectivity of newborn granule neurons through ALK by activating AKT signaling pathway (By similarity). Binds GPC2 and chondroitin sulfate proteoglycans (CSPGs) at the neuron surface, leading to abrogation of binding between PTPRS and CSPGs and neurite outgrowth promotion (By similarity). Binds SDC3 and mediates bone formation by recruiting and attaching osteoblasts/osteoblast precursors to the sites for new bone deposition (By similarity). Binds ALK and promotes cell survival and cell proliferation through MAPK pathway activation (PubMed:11278720). Inhibits proliferation and enhances differentiation of neural stem cells by inhibiting FGF2-induced fibroblast growth factor receptor signaling pathway (By similarity). Mediates regulatory mechanisms in normal hemostasis and in hematopoietic regeneration and in maintaining the balance of myeloid and lymphoid regeneration (By similarity). In addition may play a role in the female reproductive system, auditory response and the progesterone-induced decidualization pathway (By similarity). {ECO:0000250|UniProtKB:P63089, ECO:0000250|UniProtKB:P63090, ECO:0000269|PubMed:10706604, ECO:0000269|PubMed:11278720, ECO:0000269|PubMed:16814777, ECO:0000269|PubMed:1733956, ECO:0000269|PubMed:17681947, ECO:0000269|PubMed:1768439, ECO:0000269|PubMed:19141530, ECO:0000269|PubMed:19442624, ECO:0000269|PubMed:26896299, ECO:0000269|PubMed:27445335, ECO:0000269|PubMed:30667096}.",,hsa:5764;
P21583,cell adhesion [GO:0007155]; ectopic germ cell programmed cell death [GO:0035234]; embryonic hemopoiesis [GO:0035162]; extrinsic apoptotic signaling pathway in absence of ligand [GO:0097192]; male gonad development [GO:0008584]; MAPK cascade [GO:0000165]; negative regulation of mast cell apoptotic process [GO:0033026]; neural crest cell migration [GO:0001755]; ovarian follicle development [GO:0001541]; positive regulation of cell population proliferation [GO:0008284]; positive regulation of hematopoietic progenitor cell differentiation [GO:1901534]; positive regulation of hematopoietic stem cell proliferation [GO:1902035]; positive regulation of leukocyte migration [GO:0002687]; positive regulation of MAP kinase activity [GO:0043406]; positive regulation of mast cell proliferation [GO:0070668]; positive regulation of melanocyte differentiation [GO:0045636]; positive regulation of myeloid leukocyte differentiation [GO:0002763]; positive regulation of peptidyl-tyrosine phosphorylation [GO:0050731]; positive regulation of protein kinase B signaling [GO:0051897]; positive regulation of Ras protein signal transduction [GO:0046579],cytoplasm [GO:0005737]; cytoskeleton [GO:0005856]; extracellular region [GO:0005576]; extracellular space [GO:0005615]; filopodium [GO:0030175]; integral component of membrane [GO:0016021]; lamellipodium [GO:0030027]; plasma membrane [GO:0005886],cytokine activity [GO:0005125]; growth factor activity [GO:0008083]; stem cell factor receptor binding [GO:0005173],,P10721,"Ligand for the receptor-type protein-tyrosine kinase KIT. Plays an essential role in the regulation of cell survival and proliferation, hematopoiesis, stem cell maintenance, gametogenesis, mast cell development, migration and function, and in melanogenesis. KITLG/SCF binding can activate several signaling pathways. Promotes phosphorylation of PIK3R1, the regulatory subunit of phosphatidylinositol 3-kinase, and subsequent activation of the kinase AKT1. KITLG/SCF and KIT also transmit signals via GRB2 and activation of RAS, RAF1 and the MAP kinases MAPK1/ERK2 and/or MAPK3/ERK1. KITLG/SCF and KIT promote activation of STAT family members STAT1, STAT3 and STAT5. KITLG/SCF and KIT promote activation of PLCG1, leading to the production of the cellular signaling molecules diacylglycerol and inositol 1,4,5-trisphosphate. KITLG/SCF acts synergistically with other cytokines, probably interleukins.",R-HSA-1257604 [P21583-1];R-HSA-1433557 [P21583-1];R-HSA-1433559 [P21583-1];R-HSA-2219530 [P21583-1];R-HSA-5673001 [P21583-1];R-HSA-6811558 [P21583-1];,hsa:4254;
P21802,angiogenesis [GO:0001525]; animal organ morphogenesis [GO:0009887]; apoptotic process [GO:0006915]; axonogenesis [GO:0007409]; bone development [GO:0060348]; bone mineralization [GO:0030282]; bone morphogenesis [GO:0060349]; branch elongation involved in salivary gland morphogenesis [GO:0060667]; branching involved in labyrinthine layer morphogenesis [GO:0060670]; branching involved in prostate gland morphogenesis [GO:0060442]; branching involved in salivary gland morphogenesis [GO:0060445]; branching morphogenesis of a nerve [GO:0048755]; bud elongation involved in lung branching [GO:0060449]; cell-cell signaling [GO:0007267]; cell fate commitment [GO:0045165]; cellular response to retinoic acid [GO:0071300]; cellular response to transforming growth factor beta stimulus [GO:0071560]; digestive tract development [GO:0048565]; embryonic cranial skeleton morphogenesis [GO:0048701]; embryonic digestive tract morphogenesis [GO:0048557]; embryonic organ development [GO:0048568]; embryonic organ morphogenesis [GO:0048562]; embryonic pattern specification [GO:0009880]; endochondral bone growth [GO:0003416]; epidermis morphogenesis [GO:0048730]; epithelial cell differentiation [GO:0030855]; epithelial cell proliferation involved in salivary gland morphogenesis [GO:0060664]; epithelial to mesenchymal transition [GO:0001837]; fibroblast growth factor receptor signaling pathway [GO:0008543]; fibroblast growth factor receptor signaling pathway involved in hemopoiesis [GO:0035603]; fibroblast growth factor receptor signaling pathway involved in mammary gland specification [GO:0060595]; fibroblast growth factor receptor signaling pathway involved in negative regulation of apoptotic process in bone marrow cell [GO:0035602]; fibroblast growth factor receptor signaling pathway involved in orbitofrontal cortex development [GO:0035607]; fibroblast growth factor receptor signaling pathway involved in positive regulation of cell proliferation in bone marrow [GO:0035604]; gland morphogenesis [GO:0022612]; hair follicle morphogenesis [GO:0031069]; inner ear morphogenesis [GO:0042472]; in utero embryonic development [GO:0001701]; lacrimal gland development [GO:0032808]; lateral sprouting from an epithelium [GO:0060601]; limb bud formation [GO:0060174]; lung alveolus development [GO:0048286]; lung-associated mesenchyme development [GO:0060484]; lung development [GO:0030324]; lung lobe morphogenesis [GO:0060463]; mammary gland bud formation [GO:0060615]; MAPK cascade [GO:0000165]; membranous septum morphogenesis [GO:0003149]; mesenchymal cell differentiation [GO:0048762]; mesenchymal cell differentiation involved in lung development [GO:0060915]; mesenchymal cell proliferation involved in lung development [GO:0060916]; mesodermal cell differentiation [GO:0048333]; midbrain development [GO:0030901]; morphogenesis of embryonic epithelium [GO:0016331]; negative regulation of epithelial cell proliferation [GO:0050680]; negative regulation of transcription by RNA polymerase II [GO:0000122]; odontogenesis [GO:0042476]; orbitofrontal cortex development [GO:0021769]; organ growth [GO:0035265]; otic vesicle formation [GO:0030916]; outflow tract septum morphogenesis [GO:0003148]; peptidyl-tyrosine phosphorylation [GO:0018108]; positive regulation of canonical Wnt signaling pathway [GO:0090263]; positive regulation of cardiac muscle cell proliferation [GO:0060045]; positive regulation of cell cycle [GO:0045787]; positive regulation of cell division [GO:0051781]; positive regulation of cell population proliferation [GO:0008284]; positive regulation of epithelial cell proliferation [GO:0050679]; positive regulation of epithelial cell proliferation involved in lung morphogenesis [GO:0060501]; positive regulation of ERK1 and ERK2 cascade [GO:0070374]; positive regulation of MAPK cascade [GO:0043410]; positive regulation of mesenchymal cell proliferation [GO:0002053]; positive regulation of phospholipase activity [GO:0010518]; positive regulation of protein kinase B signaling [GO:0051897]; positive regulation of smooth muscle cell proliferation [GO:0048661]; positive regulation of transcription by RNA polymerase II [GO:0045944]; positive regulation of Wnt signaling pathway [GO:0030177]; post-embryonic development [GO:0009791]; prostate epithelial cord arborization involved in prostate glandular acinus morphogenesis [GO:0060527]; prostate epithelial cord elongation [GO:0060523]; prostate gland morphogenesis [GO:0060512]; protein autophosphorylation [GO:0046777]; pyramidal neuron development [GO:0021860]; regulation of ERK1 and ERK2 cascade [GO:0070372]; regulation of morphogenesis of a branching structure [GO:0060688]; regulation of osteoblast differentiation [GO:0045667]; regulation of osteoblast proliferation [GO:0033688]; regulation of smoothened signaling pathway [GO:0008589]; regulation of smooth muscle cell differentiation [GO:0051150]; reproductive structure development [GO:0048608]; response to ethanol [GO:0045471]; response to lipopolysaccharide [GO:0032496]; skeletal system morphogenesis [GO:0048705]; squamous basal epithelial stem cell differentiation involved in prostate gland acinus development [GO:0060529]; transmembrane receptor protein tyrosine kinase signaling pathway [GO:0007169]; ureteric bud development [GO:0001657]; ventricular cardiac muscle tissue morphogenesis [GO:0055010]; ventricular zone neuroblast division [GO:0021847]; wound healing [GO:0042060],cell cortex [GO:0005938]; cell surface [GO:0009986]; cytoplasm [GO:0005737]; cytoplasmic vesicle [GO:0031410]; excitatory synapse [GO:0060076]; extracellular region [GO:0005576]; Golgi apparatus [GO:0005794]; integral component of membrane [GO:0016021]; integral component of plasma membrane [GO:0005887]; membrane [GO:0016020]; nucleus [GO:0005634]; plasma membrane [GO:0005886]; receptor complex [GO:0043235],ATP binding [GO:0005524]; fibroblast growth factor-activated receptor activity [GO:0005007]; fibroblast growth factor binding [GO:0017134]; heparin binding [GO:0008201]; identical protein binding [GO:0042802]; protein homodimerization activity [GO:0042803]; protein tyrosine kinase activity [GO:0004713]; transmembrane receptor protein tyrosine kinase activity [GO:0004714],,P03968; P05230; P05230-1; O15520; P09038; P09038-2; P21781; P62993; P19174,"Tyrosine-protein kinase that acts as cell-surface receptor for fibroblast growth factors and plays an essential role in the regulation of cell proliferation, differentiation, migration and apoptosis, and in the regulation of embryonic development. Required for normal embryonic patterning, trophoblast function, limb bud development, lung morphogenesis, osteogenesis and skin development. Plays an essential role in the regulation of osteoblast differentiation, proliferation and apoptosis, and is required for normal skeleton development. Promotes cell proliferation in keratinocytes and immature osteoblasts, but promotes apoptosis in differentiated osteoblasts. Phosphorylates PLCG1, FRS2 and PAK4. Ligand binding leads to the activation of several signaling cascades. Activation of PLCG1 leads to the production of the cellular signaling molecules diacylglycerol and inositol 1,4,5-trisphosphate. Phosphorylation of FRS2 triggers recruitment of GRB2, GAB1, PIK3R1 and SOS1, and mediates activation of RAS, MAPK1/ERK2, MAPK3/ERK1 and the MAP kinase signaling pathway, as well as of the AKT1 signaling pathway. FGFR2 signaling is down-regulated by ubiquitination, internalization and degradation. Mutations that lead to constitutive kinase activation or impair normal FGFR2 maturation, internalization and degradation lead to aberrant signaling. Over-expressed FGFR2 promotes activation of STAT1. {ECO:0000269|PubMed:12529371, ECO:0000269|PubMed:15190072, ECO:0000269|PubMed:15629145, ECO:0000269|PubMed:16384934, ECO:0000269|PubMed:16597617, ECO:0000269|PubMed:17311277, ECO:0000269|PubMed:17623664, ECO:0000269|PubMed:18374639, ECO:0000269|PubMed:19103595, ECO:0000269|PubMed:19387476, ECO:0000269|PubMed:19410646, ECO:0000269|PubMed:21596750, ECO:0000269|PubMed:8663044}.",R-HSA-109704;R-HSA-1257604;R-HSA-190375;R-HSA-190377;R-HSA-2023837 [P21802-17];R-HSA-2033519;R-HSA-2219530;R-HSA-5654221;R-HSA-5654695;R-HSA-5654699;R-HSA-5654700;R-HSA-5654727;R-HSA-5655253;R-HSA-5673001;R-HSA-6811558;R-HSA-8851708;R-HSA-8853333;,hsa:2263;
P22105,actin cytoskeleton organization [GO:0030036]; cell adhesion [GO:0007155]; collagen fibril organization [GO:0030199]; collagen metabolic process [GO:0032963]; elastic fiber assembly [GO:0048251],collagen-containing extracellular matrix [GO:0062023]; extracellular exosome [GO:0070062]; extracellular matrix [GO:0031012]; extracellular region [GO:0005576]; extracellular space [GO:0005615],collagen fibril binding [GO:0098633]; extracellular matrix structural constituent [GO:0005201]; heparin binding [GO:0008201]; integrin binding [GO:0005178],"Highly expressed in fetal adrenal, in fetal testis, fetal smooth, striated and cardiac muscle. Isoform XB-short is only expressed in the adrenal gland.",Q8N9N5,Appears to mediate interactions between cells and the extracellular matrix. Substrate-adhesion molecule that appears to inhibit cell migration. Accelerates collagen fibril formation. May play a role in supporting the growth of epithelial tumors. {ECO:0000269|PubMed:17033827}.,R-HSA-3000178;,hsa:7148;
P22301,"aging [GO:0007568]; B cell differentiation [GO:0030183]; B cell proliferation [GO:0042100]; branching involved in labyrinthine layer morphogenesis [GO:0060670]; cellular response to estradiol stimulus [GO:0071392]; cellular response to hepatocyte growth factor stimulus [GO:0035729]; cellular response to lipopolysaccharide [GO:0071222]; cytokine-mediated signaling pathway [GO:0019221]; cytoplasmic sequestering of NF-kappaB [GO:0007253]; defense response to bacterium [GO:0042742]; defense response to protozoan [GO:0042832]; endothelial cell apoptotic process [GO:0072577]; hemopoiesis [GO:0030097]; inflammatory response [GO:0006954]; interleukin-12-mediated signaling pathway [GO:0035722]; leukocyte chemotaxis [GO:0030595]; liver regeneration [GO:0097421]; negative regulation of apoptotic process [GO:0043066]; negative regulation of autophagy [GO:0010507]; negative regulation of B cell proliferation [GO:0030889]; negative regulation of cell population proliferation [GO:0008285]; negative regulation of chemokine (C-C motif) ligand 5 production [GO:0071650]; negative regulation of chronic inflammatory response to antigenic stimulus [GO:0002875]; negative regulation of cytokine activity [GO:0060302]; negative regulation of cytokine production [GO:0001818]; negative regulation of cytokine secretion involved in immune response [GO:0002740]; negative regulation of heterotypic cell-cell adhesion [GO:0034115]; negative regulation of hydrogen peroxide-induced neuron death [GO:1903208]; negative regulation of inflammatory response [GO:0050728]; negative regulation of interferon-alpha biosynthetic process [GO:0045355]; negative regulation of interferon-gamma production [GO:0032689]; negative regulation of interleukin-12 production [GO:0032695]; negative regulation of interleukin-18 production [GO:0032701]; negative regulation of interleukin-1 production [GO:0032692]; negative regulation of interleukin-6 production [GO:0032715]; negative regulation of interleukin-8 production [GO:0032717]; negative regulation of membrane protein ectodomain proteolysis [GO:0051045]; negative regulation of MHC class II biosynthetic process [GO:0045347]; negative regulation of mitotic cell cycle [GO:0045930]; negative regulation of myeloid dendritic cell activation [GO:0030886]; negative regulation of nitric oxide biosynthetic process [GO:0045019]; negative regulation of sensory perception of pain [GO:1904057]; negative regulation of T cell proliferation [GO:0042130]; negative regulation of tumor necrosis factor biosynthetic process [GO:0042536]; negative regulation of tumor necrosis factor production [GO:0032720]; negative regulation of vascular smooth muscle cell proliferation [GO:1904706]; positive regulation of B cell apoptotic process [GO:0002904]; positive regulation of cell cycle [GO:0045787]; positive regulation of cytokine secretion [GO:0050715]; positive regulation of DNA-binding transcription factor activity [GO:0051091]; positive regulation of endothelial cell proliferation [GO:0001938]; positive regulation of heterotypic cell-cell adhesion [GO:0034116]; positive regulation of macrophage activation [GO:0043032]; positive regulation of MHC class II biosynthetic process [GO:0045348]; positive regulation of pri-miRNA transcription by RNA polymerase II [GO:1902895]; positive regulation of receptor signaling pathway via JAK-STAT [GO:0046427]; positive regulation of sprouting angiogenesis [GO:1903672]; positive regulation of transcription, DNA-templated [GO:0045893]; positive regulation of vascular smooth muscle cell proliferation [GO:1904707]; receptor biosynthetic process [GO:0032800]; regulation of gene expression [GO:0010468]; regulation of isotype switching [GO:0045191]; regulation of response to wounding [GO:1903034]; regulation of synapse organization [GO:0050807]; response to activity [GO:0014823]; response to carbon monoxide [GO:0034465]; response to glucocorticoid [GO:0051384]; response to inactivity [GO:0014854]; response to insulin [GO:0032868]; response to molecule of bacterial origin [GO:0002237]; type 2 immune response [GO:0042092]",extracellular region [GO:0005576]; extracellular space [GO:0005615],cytokine activity [GO:0005125]; growth factor activity [GO:0008083]; interleukin-10 receptor binding [GO:0005141]; protein dimerization activity [GO:0046983],"Produced by a variety of cell lines, including T-cells, macrophages, mast cells and other cell types. {ECO:0000269|PubMed:1940799, ECO:0000269|PubMed:7512027}.",Q13651; Q08334,"Major immune regulatory cytokine that acts on many cells of the immune system where it has profound anti-inflammatory functions, limiting excessive tissue disruption caused by inflammation. Mechanistically, IL10 binds to its heterotetrameric receptor comprising IL10RA and IL10RB leading to JAK1 and STAT2-mediated phosphorylation of STAT3 (PubMed:16982608). In turn, STAT3 translocates to the nucleus where it drives expression of anti-inflammatory mediators (PubMed:18025162). Targets antigen-presenting cells (APCs) such as macrophages and monocytes and inhibits their release of pro-inflammatory cytokines including granulocyte-macrophage colony-stimulating factor /GM-CSF, granulocyte colony-stimulating factor/G-CSF, IL-1 alpha, IL-1 beta, IL-6, IL-8 and TNF-alpha (PubMed:1940799, PubMed:7512027, PubMed:11564774). Interferes also with antigen presentation by reducing the expression of MHC-class II and co-stimulatory molecules, thereby inhibiting their ability to induce T cell activation (PubMed:8144879). In addition, controls the inflammatory response of macrophages by reprogramming essential metabolic pathways including mTOR signaling (By similarity). {ECO:0000250|UniProtKB:P18893, ECO:0000269|PubMed:11564774, ECO:0000269|PubMed:16982608, ECO:0000269|PubMed:18025162, ECO:0000269|PubMed:1940799, ECO:0000269|PubMed:7512027, ECO:0000269|PubMed:8144879}.",R-HSA-6783783;R-HSA-6785807;R-HSA-8950505;,hsa:3586;
