UniProt_ID,GO_BP,GO_CC,GO_MF,Tissue_specificity,Interactors,Function,Reactome_ID,KEGG_ID
Q10589,B cell activation [GO:0042113]; defense response to virus [GO:0051607]; innate immune response [GO:0045087]; negative regulation of cell growth [GO:0030308]; negative regulation of cell migration [GO:0030336]; negative regulation of intracellular transport of viral material [GO:1901253]; negative regulation of plasmacytoid dendritic cell cytokine production [GO:0002737]; negative regulation of viral genome replication [GO:0045071]; neutrophil degranulation [GO:0043312]; positive regulation of I-kappaB kinase/NF-kappaB signaling [GO:0043123]; positive regulation of leukocyte proliferation [GO:0070665]; regulation of actin cytoskeleton organization [GO:0032956]; response to interferon-alpha [GO:0035455]; response to interferon-beta [GO:0035456]; response to interferon-gamma [GO:0034341]; response to virus [GO:0009615]; type I interferon signaling pathway [GO:0060337],anchored component of membrane [GO:0031225]; apical plasma membrane [GO:0016324]; azurophil granule membrane [GO:0035577]; cell surface [GO:0009986]; cytosol [GO:0005829]; extracellular exosome [GO:0070062]; Golgi apparatus [GO:0005794]; integral component of membrane [GO:0016021]; membrane [GO:0016020]; membrane raft [GO:0045121]; multivesicular body [GO:0005771]; plasma membrane [GO:0005886],identical protein binding [GO:0042802]; metalloendopeptidase inhibitor activity [GO:0008191]; protein homodimerization activity [GO:0042803]; RNA binding [GO:0003723],"Predominantly expressed in liver, lung, heart and placenta. Lower levels in pancreas, kidney, skeletal muscle and brain. Overexpressed in multiple myeloma cells. Highly expressed during B-cell development, from pro-B precursors to plasma cells. Highly expressed on T-cells, monocytes, NK cells and dendritic cells (at protein level). {ECO:0000269|PubMed:10329429, ECO:0000269|PubMed:16157322}.",Itself; P35585; A9QPL9; P59901; P69699,"IFN-induced antiviral host restriction factor which efficiently blocks the release of diverse mammalian enveloped viruses by directly tethering nascent virions to the membranes of infected cells. Acts as a direct physical tether, holding virions to the cell membrane and linking virions to each other. The tethered virions can be internalized by endocytosis and subsequently degraded or they can remain on the cell surface. In either case, their spread as cell-free virions is restricted. Its target viruses belong to diverse families, including retroviridae: human immunodeficiency virus type 1 (HIV-1), human immunodeficiency virus type 2 (HIV-2), simian immunodeficiency viruses (SIVs), equine infectious anemia virus (EIAV), feline immunodeficiency virus (FIV), prototype foamy virus (PFV), Mason-Pfizer monkey virus (MPMV), human T-cell leukemia virus type 1 (HTLV-1), Rous sarcoma virus (RSV) and murine leukemia virus (MLV), flavivirideae: hepatitis C virus (HCV), filoviridae: ebola virus (EBOV) and marburg virus (MARV), arenaviridae: lassa virus (LASV) and machupo virus (MACV), herpesviridae: kaposis sarcoma-associated herpesvirus (KSHV), rhabdoviridae: vesicular stomatitis virus (VSV), orthomyxoviridae: influenza A virus, and paramyxoviridae: nipah virus. Can inhibit cell surface proteolytic activity of MMP14 causing decreased activation of MMP15 which results in inhibition of cell growth and migration. Can stimulate signaling by LILRA4/ILT7 and consequently provide negative feedback to the production of IFN by plasmacytoid dendritic cells in response to viral infection (PubMed:19564354, PubMed:26172439). Plays a role in the organization of the subapical actin cytoskeleton in polarized epithelial cells. Isoform 1 and isoform 2 are both effective viral restriction factors but have differing antiviral and signaling activities (PubMed:23028328, PubMed:26172439). Isoform 2 is resistant to HIV-1 Vpu-mediated degradation and restricts HIV-1 viral budding in the presence of Vpu (PubMed:23028328, PubMed:26172439). Isoform 1 acts as an activator of NF-kappa-B and this activity is inhibited by isoform 2 (PubMed:23028328). {ECO:0000269|PubMed:18200009, ECO:0000269|PubMed:18342597, ECO:0000269|PubMed:19036818, ECO:0000269|PubMed:19179289, ECO:0000269|PubMed:19564354, ECO:0000269|PubMed:19879838, ECO:0000269|PubMed:20399176, ECO:0000269|PubMed:20419159, ECO:0000269|PubMed:20686043, ECO:0000269|PubMed:20940320, ECO:0000269|PubMed:20943977, ECO:0000269|PubMed:21529378, ECO:0000269|PubMed:21621240, ECO:0000269|PubMed:22065321, ECO:0000269|PubMed:22520941, ECO:0000269|PubMed:23028328, ECO:0000269|PubMed:26172439}.",R-HSA-6798695;R-HSA-909733;,hsa:684;
Q12805,"camera-type eye development [GO:0043010]; embryonic eye morphogenesis [GO:0048048]; epidermal growth factor receptor signaling pathway [GO:0007173]; negative regulation of chondrocyte differentiation [GO:0032331]; peptidyl-tyrosine phosphorylation [GO:0018108]; post-embryonic eye morphogenesis [GO:0048050]; regulation of transcription, DNA-templated [GO:0006355]; visual perception [GO:0007601]",collagen-containing extracellular matrix [GO:0062023]; extracellular exosome [GO:0070062]; extracellular matrix [GO:0031012]; extracellular region [GO:0005576]; extracellular space [GO:0005615],calcium ion binding [GO:0005509]; epidermal growth factor-activated receptor activity [GO:0005006]; epidermal growth factor receptor binding [GO:0005154]; growth factor activity [GO:0008083],"In the eye, associated with photoreceptor outer and inner segment regions, the nerve fiber layer, outer nuclear layer and inner and outer plexiform layers of the retina. {ECO:0000269|PubMed:12242346, ECO:0000269|PubMed:20005202}.",Q9WMX2; P10398; P54259; P46379; P53673; P50222; Q6FHY5; Q9NPQ8-4; O43765; Q12933; Q86UY0; Q9UHD9,"Binds EGFR, the EGF receptor, inducing EGFR autophosphorylation and the activation of downstream signaling pathways. May play a role in cell adhesion and migration. May function as a negative regulator of chondrocyte differentiation. In the olfactory epithelium, it may regulate glial cell migration, differentiation and the ability of glial cells to support neuronal neurite outgrowth. {ECO:0000269|PubMed:19804359, ECO:0000269|PubMed:19887559, ECO:0000269|PubMed:20005202}.",R-HSA-2129379;,hsa:2202;
Q12860,cell adhesion [GO:0007155]; cerebellum development [GO:0021549]; neuron projection development [GO:0031175]; Notch signaling pathway [GO:0007219]; positive regulation of gene expression [GO:0010628]; positive regulation of neuron projection development [GO:0010976]; positive regulation of peptidyl-tyrosine phosphorylation [GO:0050731]; positive regulation of sodium ion transport [GO:0010765],anchored component of postsynaptic membrane [GO:0099025]; anchored component of presynaptic membrane [GO:0099026]; extracellular exosome [GO:0070062]; membrane [GO:0016020]; membrane raft [GO:0045121],carbohydrate binding [GO:0030246],"Strongly expressed in brain and in neuroblastoma and retinoblastoma cell lines. Lower levels of expression in lung, pancreas, kidney and skeletal muscle. {ECO:0000269|PubMed:2026173, ECO:0000269|PubMed:8164510}.",Q9UHC6; P23471,Contactins mediate cell surface interactions during nervous system development. Involved in the formation of paranodal axo-glial junctions in myelinated peripheral nerves and in the signaling between axons and myelinating glial cells via its association with CNTNAP1. Participates in oligodendrocytes generation by acting as a ligand of NOTCH1. Its association with NOTCH1 promotes NOTCH1 activation through the released notch intracellular domain (NICD) and subsequent translocation to the nucleus. Interaction with TNR induces a repulsion of neurons and an inhibition of neurite outgrowth (By similarity). {ECO:0000250}.,R-HSA-2122948;R-HSA-2979096;R-HSA-373760;R-HSA-447043;,hsa:1272;
Q12864,adherens junction organization [GO:0034332]; calcium-dependent cell-cell adhesion via plasma membrane cell adhesion molecules [GO:0016339]; cell adhesion [GO:0007155]; cell-cell adhesion [GO:0098609]; cell-cell adhesion mediated by cadherin [GO:0044331]; cell-cell junction assembly [GO:0007043]; cell morphogenesis [GO:0000902]; germinal center B cell differentiation [GO:0002314]; homophilic cell adhesion via plasma membrane adhesion molecules [GO:0007156]; integrin-mediated signaling pathway [GO:0007229]; marginal zone B cell differentiation [GO:0002315]; oligopeptide transmembrane transport [GO:0035672]; oligopeptide transport [GO:0006857]; positive regulation of integrin activation by cell surface receptor linked signal transduction [GO:0033626]; spleen development [GO:0048536],basolateral plasma membrane [GO:0016323]; catenin complex [GO:0016342]; cell-cell adherens junction [GO:0005913]; cell junction [GO:0030054]; cell surface [GO:0009986]; integral component of membrane [GO:0016021]; nucleoplasm [GO:0005654]; plasma membrane [GO:0005886],cadherin binding [GO:0045296]; calcium ion binding [GO:0005509]; cytoskeletal protein binding [GO:0008092]; integrin binding [GO:0005178]; protein homodimerization activity [GO:0042803]; proton-dependent oligopeptide secondary active transmembrane transporter activity [GO:0005427]; transporter activity [GO:0005215],"Expressed in the gastrointestinal tract and pancreatic duct. Not detected in kidney, lung, liver, brain, adrenal gland and skin. {ECO:0000269|PubMed:8153632}.",,Cadherins are calcium-dependent cell adhesion proteins. They preferentially interact with themselves in a homophilic manner in connecting cells; cadherins may thus contribute to the sorting of heterogeneous cell types. LI-cadherin may have a role in the morphological organization of liver and intestine. Involved in intestinal peptide transport. {ECO:0000269|PubMed:8153632}.,R-HSA-418990;,hsa:1015;
Q12884,angiogenesis [GO:0001525]; cell adhesion [GO:0007155]; endothelial cell migration [GO:0043542]; melanocyte apoptotic process [GO:1902362]; melanocyte proliferation [GO:0097325]; mitotic cell cycle arrest [GO:0071850]; negative regulation of cell proliferation involved in contact inhibition [GO:0060244]; negative regulation of extracellular matrix disassembly [GO:0010716]; negative regulation of extracellular matrix organization [GO:1903054]; positive regulation of cell cycle arrest [GO:0071158]; positive regulation of execution phase of apoptosis [GO:1900119]; proteolysis [GO:0006508]; proteolysis involved in cellular protein catabolic process [GO:0051603]; regulation of collagen catabolic process [GO:0010710]; regulation of fibrinolysis [GO:0051917],apical part of cell [GO:0045177]; basal part of cell [GO:0045178]; cell surface [GO:0009986]; cytoplasm [GO:0005737]; extracellular space [GO:0005615]; focal adhesion [GO:0005925]; integral component of membrane [GO:0016021]; invadopodium membrane [GO:0071438]; lamellipodium [GO:0030027]; lamellipodium membrane [GO:0031258]; plasma membrane [GO:0005886]; ruffle membrane [GO:0032587],dipeptidyl-peptidase activity [GO:0008239]; endopeptidase activity [GO:0004175]; integrin binding [GO:0005178]; metalloendopeptidase activity [GO:0004222]; peptidase activity [GO:0008233]; protease binding [GO:0002020]; protein dimerization activity [GO:0046983]; protein homodimerization activity [GO:0042803]; serine-type endopeptidase activity [GO:0004252]; serine-type peptidase activity [GO:0008236],"Expressed in adipose tissue. Expressed in the dermal fibroblasts in the fetal skin. Expressed in the granulation tissue of healing wounds and on reactive stromal fibroblast in epithelial cancers. Expressed in activated fibroblast-like synoviocytes from inflamed synovial tissues. Expressed in activated hepatic stellate cells (HSC) and myofibroblasts from cirrhotic liver, but not detected in normal liver. Expressed in glioma cells (at protein level). Expressed in glioblastomas and glioma cells. Isoform 1 and isoform 2 are expressed in melanoma, carcinoma and fibroblast cell lines. {ECO:0000269|PubMed:10347120, ECO:0000269|PubMed:10593948, ECO:0000269|PubMed:10644713, ECO:0000269|PubMed:16175601, ECO:0000269|PubMed:17105646, ECO:0000269|PubMed:20707604, ECO:0000269|PubMed:24371721, ECO:0000269|PubMed:7911242}.",P01275; P01282,"Cell surface glycoprotein serine protease that participates in extracellular matrix degradation and involved in many cellular processes including tissue remodeling, fibrosis, wound healing, inflammation and tumor growth. Both plasma membrane and soluble forms exhibit post-proline cleaving endopeptidase activity, with a marked preference for Ala/Ser-Gly-Pro-Ser/Asn/Ala consensus sequences, on substrate such as alpha-2-antiplasmin SERPINF2 and SPRY2 (PubMed:14751930, PubMed:16223769, PubMed:16480718, PubMed:16410248, PubMed:17381073, PubMed:18095711, PubMed:21288888, PubMed:24371721). Degrade also gelatin, heat-denatured type I collagen, but not native collagen type I and IV, vibronectin, tenascin, laminin, fibronectin, fibrin or casein (PubMed:9065413, PubMed:2172980, PubMed:7923219, PubMed:10347120, PubMed:10455171, PubMed:12376466, PubMed:16223769, PubMed:16651416, PubMed:18095711). Have also dipeptidyl peptidase activity, exhibiting the ability to hydrolyze the prolyl bond two residues from the N-terminus of synthetic dipeptide substrates provided that the penultimate residue is proline, with a preference for Ala-Pro, Ile-Pro, Gly-Pro, Arg-Pro and Pro-Pro (PubMed:10347120, PubMed:10593948, PubMed:16175601, PubMed:16223769, PubMed:16651416, PubMed:16410248, PubMed:17381073, PubMed:21314817, PubMed:24371721, PubMed:24717288). Natural neuropeptide hormones for dipeptidyl peptidase are the neuropeptide Y (NPY), peptide YY (PYY), substance P (TAC1) and brain natriuretic peptide 32 (NPPB) (PubMed:21314817). The plasma membrane form, in association with either DPP4, PLAUR or integrins, is involved in the pericellular proteolysis of the extracellular matrix (ECM), and hence promotes cell adhesion, migration and invasion through the ECM. Plays a role in tissue remodeling during development and wound healing. Participates in the cell invasiveness towards the ECM in malignant melanoma cancers. Enhances tumor growth progression by increasing angiogenesis, collagen fiber degradation and apoptosis and by reducing antitumor response of the immune system. Promotes glioma cell invasion through the brain parenchyma by degrading the proteoglycan brevican. Acts as a tumor suppressor in melanocytic cells through regulation of cell proliferation and survival in a serine protease activity-independent manner. {ECO:0000250|UniProtKB:P97321, ECO:0000269|PubMed:10347120, ECO:0000269|PubMed:10455171, ECO:0000269|PubMed:10593948, ECO:0000269|PubMed:12376466, ECO:0000269|PubMed:14751930, ECO:0000269|PubMed:16175601, ECO:0000269|PubMed:16223769, ECO:0000269|PubMed:16410248, ECO:0000269|PubMed:16480718, ECO:0000269|PubMed:16651416, ECO:0000269|PubMed:17105646, ECO:0000269|PubMed:17381073, ECO:0000269|PubMed:18095711, ECO:0000269|PubMed:20707604, ECO:0000269|PubMed:21288888, ECO:0000269|PubMed:21314817, ECO:0000269|PubMed:2172980, ECO:0000269|PubMed:24371721, ECO:0000269|PubMed:24717288, ECO:0000269|PubMed:7923219, ECO:0000269|PubMed:9065413}.",,hsa:2191;
Q13007,apoptotic process [GO:0006915]; cellular response to interleukin-4 [GO:0071353]; cellular response to lipopolysaccharide [GO:0071222]; cytokine-mediated signaling pathway [GO:0019221]; negative regulation of cell migration [GO:0030336]; negative regulation of cell population proliferation [GO:0008285]; positive regulation of cell population proliferation [GO:0008284]; positive regulation of tyrosine phosphorylation of STAT protein [GO:0042531]; serine phosphorylation of STAT protein [GO:0042501]; wound healing [GO:0042060],extracellular region [GO:0005576]; extracellular space [GO:0005615],cytokine activity [GO:0005125],Up-regulated in melanoma cells induced to terminally differentiate.,Q13315; O96017; P09874; Q06609,Has antiproliferative properties on melanoma cells and may contribute to terminal cell differentiation.,R-HSA-8854691;,hsa:11009;
Q13093,lipid catabolic process [GO:0016042]; lipid oxidation [GO:0034440]; low-density lipoprotein particle remodeling [GO:0034374]; plasma lipoprotein particle oxidation [GO:0034441]; platelet activating factor metabolic process [GO:0046469]; positive regulation of inflammatory response [GO:0050729]; positive regulation of monocyte chemotaxis [GO:0090026],cytoplasm [GO:0005737]; extracellular region [GO:0005576]; low-density lipoprotein particle [GO:0034362],"1-alkyl-2-acetylglycerophosphocholine esterase activity [GO:0003847]; calcium-independent phospholipase A2 activity [GO:0047499]; hydrolase activity, acting on ester bonds [GO:0016788]; phospholipid binding [GO:0005543]",Plasma.,,Modulates the action of platelet-activating factor (PAF) by hydrolyzing the sn-2 ester bond to yield the biologically inactive lyso-PAF. Has a specificity for substrates with a short residue at the sn-2 position. It is inactive against long-chain phospholipids.,R-HSA-422085;,hsa:7941;
Q13231,chitin catabolic process [GO:0006032]; immune response [GO:0006955]; neutrophil degranulation [GO:0043312]; polysaccharide catabolic process [GO:0000272]; polysaccharide digestion [GO:0044245]; response to bacterium [GO:0009617],cytoplasm [GO:0005737]; extracellular region [GO:0005576]; extracellular space [GO:0005615]; lysosome [GO:0005764]; specific granule lumen [GO:0035580]; tertiary granule lumen [GO:1904724],"chitinase activity [GO:0004568]; chitin binding [GO:0008061]; endochitinase activity [GO:0008843]; hydrolase activity, hydrolyzing O-glycosyl compounds [GO:0004553]",Detected in spleen. Secreted by cultured macrophages. {ECO:0000269|PubMed:7836450}.,,"Degrades chitin, chitotriose and chitobiose. May participate in the defense against nematodes and other pathogens. Isoform 3 has no enzymatic activity. {ECO:0000269|PubMed:7592832, ECO:0000269|PubMed:7836450}.",R-HSA-189085;R-HSA-6798695;,hsa:1118;
Q13241,cell surface receptor signaling pathway [GO:0007166]; innate immune response [GO:0045087]; natural killer cell mediated immunity [GO:0002228]; regulation of immune response [GO:0050776],external side of plasma membrane [GO:0009897]; integral component of membrane [GO:0016021]; plasma membrane [GO:0005886]; receptor complex [GO:0043235],"carbohydrate binding [GO:0030246]; MHC class Ib protein binding, via antigen binding groove [GO:0023030]; MHC class I protein complex binding [GO:0023024]; protein antigen binding [GO:1990405]; transmembrane signaling receptor activity [GO:0004888]",Natural killer cells.,P26715,"Plays a role as a receptor for the recognition of MHC class I HLA-E molecules by NK cells and some cytotoxic T-cells. {ECO:0000269|PubMed:10023772, ECO:0000269|PubMed:18083576, ECO:0000269|PubMed:9655483}.",R-HSA-198933;R-HSA-2172127;R-HSA-2424491;,hsa:3824;
Q13261,interleukin-15-mediated signaling pathway [GO:0035723]; positive regulation of phagocytosis [GO:0050766],cell surface [GO:0009986]; cytoplasmic vesicle membrane [GO:0030659]; endoplasmic reticulum membrane [GO:0005789]; endosome [GO:0005768]; extracellular space [GO:0005615]; Golgi membrane [GO:0000139]; integral component of membrane [GO:0016021]; nuclear membrane [GO:0031965]; plasma membrane [GO:0005886],cytokine receptor activity [GO:0004896]; interleukin-15 receptor activity [GO:0042010]; protein kinase binding [GO:0019901],"Expressed in neutrophils (at protein level) (PubMed:15123770). Expressed in fetal brain with higher expression in the hippocampus and cerebellum than in cortex and thalamus (PubMed:12114302). Higher levels of soluble sIL-15RA form in comparison with membrane-bound forms is present in all brain structures (PubMed:12114302). Isoforms 1, 3, 4, 5, 6, 7, 8 and 9: Widely expressed (PubMed:10480910, PubMed:8530383). {ECO:0000269|PubMed:10480910, ECO:0000269|PubMed:12114302, ECO:0000269|PubMed:15123770, ECO:0000269|PubMed:8530383}.",P40933,"High-affinity receptor for interleukin-15 (PubMed:8530383). Can signal both in cis and trans where IL15R from one subset of cells presents IL15 to neighboring IL2RG-expressing cells (By similarity). In neutrophils, binds and activates kinase SYK in response to IL15 stimulation (PubMed:15123770). In neutrophils, required for IL15-induced phagocytosis in a SYK-dependent manner (PubMed:15123770). Expression of different isoforms may alter or interfere with signal transduction (PubMed:10480910). {ECO:0000250|UniProtKB:Q60819, ECO:0000269|PubMed:10480910, ECO:0000269|PubMed:15123770, ECO:0000269|PubMed:8530383}.; Isoform 5: Does not bind IL15. {ECO:0000269|PubMed:10480910}.; Isoform 6: Does not bind IL15. {ECO:0000269|PubMed:10480910}.; Isoform 7: Does not bind IL15. {ECO:0000269|PubMed:10480910}.; Isoform 8: Does not bind IL15. {ECO:0000269|PubMed:10480910}.",R-HSA-8983432;,hsa:3601;
Q13291,adaptive immune response [GO:0002250]; cell adhesion [GO:0007155]; innate immune response [GO:0045087]; lymphocyte activation [GO:0046649]; myeloid dendritic cell activation involved in immune response [GO:0002277]; negative regulation of CD40 signaling pathway [GO:2000349]; negative regulation of interleukin-12 production [GO:0032695]; negative regulation of interleukin-6 production [GO:0032715]; negative regulation of tumor necrosis factor production [GO:0032720]; phagocytosis [GO:0006909]; positive regulation of cell population proliferation [GO:0008284]; positive regulation of ERK1 and ERK2 cascade [GO:0070374]; positive regulation of JNK cascade [GO:0046330],cell surface [GO:0009986]; extracellular exosome [GO:0070062]; integral component of membrane [GO:0016021]; plasma membrane [GO:0005886],antigen binding [GO:0003823]; identical protein binding [GO:0042802]; transmembrane signaling receptor activity [GO:0004888]; virus receptor activity [GO:0001618],"Constitutively expressed on peripheral blood memory T-cells, T-cell clones, immature thymocytes and a proportion of B-cells, and is rapidly induced on naive T-cells after activation (PubMed:7617038). Activated B-cells express isoform 1, isoform 3 and a cytoplasmic isoform (PubMed:9091591). Isoform 4 is expressed in B-cells, primary T-cells, dendritic cells and macrophages. Isoform 4 is expressed in tumors of the central nervous system (PubMed:25710480). {ECO:0000269|PubMed:25710480, ECO:0000269|PubMed:7617038, ECO:0000269|PubMed:9091591}.",Itself; Q786F2; Q92918; O60880; O60880-1,"Self-ligand receptor of the signaling lymphocytic activation molecule (SLAM) family. SLAM receptors triggered by homo- or heterotypic cell-cell interactions are modulating the activation and differentiation of a wide variety of immune cells and thus are involved in the regulation and interconnection of both innate and adaptive immune response. Activities are controlled by presence or absence of small cytoplasmic adapter proteins, SH2D1A/SAP and/or SH2D1B/EAT-2. SLAMF1-induced signal-transduction events in T-lymphocytes are different from those in B-cells. Two modes of SLAMF1 signaling seem to exist: one depending on SH2D1A (and perhaps SH2D1B) and another in which protein-tyrosine phosphatase 2C (PTPN11)-dependent signal transduction operates. Initially it has been proposed that association with SH2D1A prevents binding to inhibitory effectors including INPP5D/SHIP1 and PTPN11/SHP-2 (PubMed:11806999). However, signaling is also regulated by SH2D1A which can simultaneously interact with and recruit FYN which subsequently phosphorylates and activates SLAMF1 (PubMed:12458214). Mediates IL-2-independent proliferation of activated T-cells during immune responses and induces IFN-gamma production (By similarity). Downstreaming signaling involves INPP5D, DOK1 and DOK2 leading to inhibited IFN-gamma production in T-cells, and PRKCQ, BCL10 and NFKB1 leading to increased T-cell activation and Th2 cytokine production (By similarity). Promotes T-cell receptor-induced IL-4 secretion by CD4(+) cells (By similarity). Inhibits antigen receptor-mediated production of IFN-gamma, but not IL-2, in CD4(-)/CD8(-) T-cells (By similarity). Required for IL-4 production by germinal centers T follicular helper (T(Fh))cells (By similarity). May inhibit CD40-induced signal transduction in monocyte-derived dendritic cells (PubMed:16317102). May play a role in allergic responses and may regulate allergen-induced Th2 cytokine and Th1 cytokine secretion (By similarity). In conjunction with SLAMF6 controls the transition between positive selection and the subsequent expansion and differentiation of the thymocytic natural killer T (NKT) cell lineage. Involved in the peripheral differentiation of indifferent natural killer T (iNKT) cells toward a regulatory NKT2 type (By similarity). In macrophages involved in down-regulation of IL-12, TNF-alpha and nitric oxide in response to lipopolysaccharide (LPS) (By similarity). In B-cells activates the ERK signaling pathway independently of SH2D1A but implicating both, SYK and INPP5D, and activates Akt signaling dependent on SYK and SH2D1A (By similarity). In B-cells also activates p38 MAPK and JNK1 and JNK2 (PubMed:20231852). In conjunction with CD84/SLAMF5 and SLAMF6 may be a negative regulator of the humoral immune response (By similarity). Involved in innate immune response against Gram-negative bacteria in macrophages; probably recognizes OmpC and/or OmpF on the bacterial surface, regulates phagosome maturation and recruitment of the PI3K complex II (PI3KC3-C2) leading to accumulation of PdtIns(3)P and NOX2 activity in the phagosomes (PubMed:20818396). {ECO:0000250|UniProtKB:Q9QUM4, ECO:0000269|PubMed:16317102, ECO:0000269|PubMed:20231852, ECO:0000269|PubMed:20818396, ECO:0000305|PubMed:11806999, ECO:0000305|PubMed:12458214}.; (Microbial infection) Acts as a receptor for Measles virus; also including isoform 4. {ECO:0000269|PubMed:10972291, ECO:0000269|PubMed:25710480}.",,hsa:6504;
